{"actions":[{"action_id":"create_pin","cases":[{"case_id":"CASE-20bef088ebc99c0feea3f468","component_expectations":[{"component":"authoritative_state","contract_field_refs":["actions/create_pin/forbidden_mutations","actions/create_pin/rejection"],"expectation":"UNCHANGED"},{"component":"business_side_effects","contract_field_refs":["actions/create_pin/forbidden_mutations","actions/create_pin/rejection"],"expectation":"UNCHANGED"},{"component":"delivery_effects","contract_field_refs":["actions/create_pin/forbidden_mutations","actions/create_pin/rejection"],"expectation":"UNCHANGED"},{"component":"history","contract_field_refs":["actions/create_pin/forbidden_mutations","actions/create_pin/rejection"],"expectation":"UNCHANGED"},{"component":"revision","contract_field_refs":["actions/create_pin/forbidden_mutations","actions/create_pin/rejection"],"expectation":"UNCHANGED"}],"contract_field_refs":["actions/create_pin/authentication","actions/create_pin/forbidden_mutations","actions/create_pin/forbidden_states","actions/create_pin/input_invariants","actions/create_pin/preconditions","actions/create_pin/rejection","actions/create_pin/relationship_predicate"],"evidence_assertions":[{"contract_field_refs":["actions/create_pin/rejection"],"pointer":"/result/error/code","type":"path_present"}],"fixture_requirements":["OPAQUE_ID"],"result_expectation":{"contract_field_refs":["actions/create_pin/authentication","actions/create_pin/forbidden_states","actions/create_pin/input_invariants","actions/create_pin/preconditions","actions/create_pin/rejection","actions/create_pin/relationship_predicate"],"result_class":"REJECTED"},"test_id":"TEST-20bef088ebc99c0feea3f468"},{"case_id":"CASE-81987fbd406c633781630ed7","component_expectations":[{"component":"authoritative_state","contract_field_refs":["actions/create_pin/concurrency","actions/create_pin/forbidden_mutations","actions/create_pin/idempotency","actions/create_pin/recovery"],"expectation":"UNCHANGED"},{"component":"business_side_effects","contract_field_refs":["actions/create_pin/concurrency","actions/create_pin/forbidden_mutations","actions/create_pin/idempotency","actions/create_pin/recovery"],"expectation":"UNCHANGED"},{"component":"delivery_effects","contract_field_refs":["actions/create_pin/concurrency","actions/create_pin/forbidden_mutations","actions/create_pin/idempotency","actions/create_pin/recovery"],"expectation":"UNCHANGED"},{"component":"history","contract_field_refs":["actions/create_pin/concurrency","actions/create_pin/forbidden_mutations","actions/create_pin/idempotency","actions/create_pin/recovery"],"expectation":"UNCHANGED"},{"component":"revision","contract_field_refs":["actions/create_pin/concurrency","actions/create_pin/forbidden_mutations","actions/create_pin/idempotency","actions/create_pin/recovery"],"expectation":"UNCHANGED"}],"contract_field_refs":["actions/create_pin/concurrency","actions/create_pin/forbidden_mutations","actions/create_pin/idempotency","actions/create_pin/recovery"],"evidence_assertions":[{"contract_field_refs":["actions/create_pin/idempotency","actions/create_pin/recovery"],"pointer":"/result/committed_result","type":"path_present"}],"fixture_requirements":["ATTEMPT_ID","OPAQUE_ID","REVISION_INSTANCE"],"result_expectation":{"contract_field_refs":["actions/create_pin/concurrency","actions/create_pin/idempotency","actions/create_pin/recovery"],"result_class":"IDEMPOTENT_REPLAY"},"test_id":"TEST-81987fbd406c633781630ed7"},{"case_id":"CASE-85ccbf28bfbd43546486fef2","component_expectations":[{"component":"authoritative_state","contract_field_refs":["actions/create_pin/business_side_effects","actions/create_pin/concurrency","actions/create_pin/delivery_effects","actions/create_pin/expected_domain_mutation","actions/create_pin/forbidden_mutations","actions/create_pin/history_result","actions/create_pin/object_binding","actions/create_pin/superseded_rules","actions/create_pin/version_result"],"expectation":"CHANGED"},{"component":"business_side_effects","contract_field_refs":["actions/create_pin/business_side_effects","actions/create_pin/concurrency","actions/create_pin/delivery_effects","actions/create_pin/expected_domain_mutation","actions/create_pin/forbidden_mutations","actions/create_pin/history_result","actions/create_pin/object_binding","actions/create_pin/superseded_rules","actions/create_pin/version_result"],"expectation":"CHANGED"},{"component":"delivery_effects","contract_field_refs":["actions/create_pin/business_side_effects","actions/create_pin/concurrency","actions/create_pin/delivery_effects","actions/create_pin/expected_domain_mutation","actions/create_pin/forbidden_mutations","actions/create_pin/history_result","actions/create_pin/object_binding","actions/create_pin/superseded_rules","actions/create_pin/version_result"],"expectation":"UNCHANGED"},{"component":"history","contract_field_refs":["actions/create_pin/business_side_effects","actions/create_pin/concurrency","actions/create_pin/delivery_effects","actions/create_pin/expected_domain_mutation","actions/create_pin/forbidden_mutations","actions/create_pin/history_result","actions/create_pin/object_binding","actions/create_pin/superseded_rules","actions/create_pin/version_result"],"expectation":"CHANGED"},{"component":"revision","contract_field_refs":["actions/create_pin/business_side_effects","actions/create_pin/concurrency","actions/create_pin/delivery_effects","actions/create_pin/expected_domain_mutation","actions/create_pin/forbidden_mutations","actions/create_pin/history_result","actions/create_pin/object_binding","actions/create_pin/superseded_rules","actions/create_pin/version_result"],"expectation":"CHANGED"}],"contract_field_refs":["actions/create_pin/actor","actions/create_pin/allowed_current_states","actions/create_pin/authentication","actions/create_pin/business_side_effects","actions/create_pin/command","actions/create_pin/concurrency","actions/create_pin/delivery_effects","actions/create_pin/expected_domain_mutation","actions/create_pin/forbidden_mutations","actions/create_pin/history_result","actions/create_pin/input_invariants","actions/create_pin/object_binding","actions/create_pin/preconditions","actions/create_pin/relationship_predicate","actions/create_pin/superseded_rules","actions/create_pin/version_result"],"evidence_assertions":[{"contract_field_refs":["actions/create_pin/actor","actions/create_pin/authentication","actions/create_pin/relationship_predicate"],"expected_value_source":{"contract_field_path":"actions/create_pin/actor","pointer":"/value","source":"CONTRACT_DERIVED"},"pointer":"/command/actor","type":"path_equals"},{"contract_field_refs":["actions/create_pin/command"],"pointer":"/command/action_id","type":"path_present"}],"fixture_requirements":["OPAQUE_ID","REVISION_INSTANCE"],"result_expectation":{"contract_field_refs":["actions/create_pin/allowed_current_states","actions/create_pin/input_invariants","actions/create_pin/preconditions","actions/create_pin/version_result"],"result_class":"SUCCESS"},"test_id":"TEST-85ccbf28bfbd43546486fef2"}],"covered_contract_field_refs":["actions/create_pin/actor","actions/create_pin/allowed_current_states","actions/create_pin/authentication","actions/create_pin/business_side_effects","actions/create_pin/command","actions/create_pin/concurrency","actions/create_pin/delivery_effects","actions/create_pin/expected_domain_mutation","actions/create_pin/forbidden_mutations","actions/create_pin/forbidden_states","actions/create_pin/history_result","actions/create_pin/idempotency","actions/create_pin/input_invariants","actions/create_pin/object_binding","actions/create_pin/preconditions","actions/create_pin/recovery","actions/create_pin/rejection","actions/create_pin/relationship_predicate","actions/create_pin/superseded_rules","actions/create_pin/version_result"]},{"action_id":"reply_thread","cases":[{"case_id":"CASE-4e947cf748c72ff82f039283","component_expectations":[{"component":"authoritative_state","contract_field_refs":["actions/reply_thread/concurrency","actions/reply_thread/forbidden_mutations","actions/reply_thread/idempotency","actions/reply_thread/recovery"],"expectation":"UNCHANGED"},{"component":"business_side_effects","contract_field_refs":["actions/reply_thread/concurrency","actions/reply_thread/forbidden_mutations","actions/reply_thread/idempotency","actions/reply_thread/recovery"],"expectation":"UNCHANGED"},{"component":"delivery_effects","contract_field_refs":["actions/reply_thread/concurrency","actions/reply_thread/forbidden_mutations","actions/reply_thread/idempotency","actions/reply_thread/recovery"],"expectation":"UNCHANGED"},{"component":"history","contract_field_refs":["actions/reply_thread/concurrency","actions/reply_thread/forbidden_mutations","actions/reply_thread/idempotency","actions/reply_thread/recovery"],"expectation":"UNCHANGED"},{"component":"revision","contract_field_refs":["actions/reply_thread/concurrency","actions/reply_thread/forbidden_mutations","actions/reply_thread/idempotency","actions/reply_thread/recovery"],"expectation":"UNCHANGED"}],"contract_field_refs":["actions/reply_thread/concurrency","actions/reply_thread/forbidden_mutations","actions/reply_thread/idempotency","actions/reply_thread/recovery"],"evidence_assertions":[{"contract_field_refs":["actions/reply_thread/idempotency","actions/reply_thread/recovery"],"pointer":"/result/committed_result","type":"path_present"}],"fixture_requirements":["ATTEMPT_ID","OPAQUE_ID","REVISION_INSTANCE"],"result_expectation":{"contract_field_refs":["actions/reply_thread/concurrency","actions/reply_thread/idempotency","actions/reply_thread/recovery"],"result_class":"IDEMPOTENT_REPLAY"},"test_id":"TEST-4e947cf748c72ff82f039283"},{"case_id":"CASE-6455608d40e9c8545d802a18","component_expectations":[{"component":"authoritative_state","contract_field_refs":["actions/reply_thread/forbidden_mutations","actions/reply_thread/rejection"],"expectation":"UNCHANGED"},{"component":"business_side_effects","contract_field_refs":["actions/rep